rule_id,phase,priority,action,root_kind,block,prior_semantics,inference,tau_selector,family_selector,fit_size_selector,target_profile,audit_required,hold_fixed,target_behavior,rationale
static_paper_mcmc_propagate,phase1_static,1,propagate,static,static_paper,paper,mcmc,*,*,*,static_exal_ref_slice_long,FALSE,FALSE,make paper-style exAL MCMC the default reference for this cluster,strongest metric cluster and benchmark-aligned win
static_shrink_ridge_mcmc_propagate,phase1_static,2,propagate,static,static_shrink,ridge,mcmc,*,*,*,static_exal_ref_slice_long_shrink,FALSE,FALSE,extend the strong static MCMC exAL profile into ridge shrinkage,cluster is strongly favorable to exAL on broader metrics
static_shrink_rhs_mcmc_audit_then_propagate,phase1_static,3,audit_then_propagate,static,static_shrink,rhs,mcmc,*,*,*,static_exal_ref_slice_long_shrink,TRUE,FALSE,split rhs versus rhs_ns before any default propagation,prior label may collapse multiple prior implementations
static_vb_tau025_repair,phase2_static_vb,4,repair,static,*,*,vb,0p25,*,*,static_exal_vb_tau025_repair,FALSE,FALSE,repair the known weak tau 0.25 exAL VB pocket,cluster diagnosis shows broad tau 0.25 weakness
static_vb_non025_hold_monitor,phase2_static_vb,5,hold_monitor,static,*,*,vb,0p05|0p95,*,*,static_exal_vb_hold,FALSE,TRUE,keep current non-0.25 VB clusters as monitor-only until tau 0.25 is understood,non-0.25 VB is mixed-to-positive and should not be perturbed first
dynamic_tau095_mcmc_reinforce,phase3_dynamic,6,reinforce,dynamic,*,default,mcmc,0p95,*,*,dynamic_exdqlm_tau095_ref,FALSE,FALSE,stabilize the strongest exDQLM MCMC tail cluster,cluster diagnosis shows tau 0.95 is the clear dynamic strength
dynamic_tau095_vb_reinforce,phase3_dynamic,7,reinforce,dynamic,*,default,vb,0p95,*,*,dynamic_exdqlm_tau095_ref_vb,FALSE,FALSE,stabilize the strongest exDQLM VB tail cluster,loss-based metrics are strongest here
dynamic_lowmid_mcmc_repair,phase4_dynamic_repair,8,repair,dynamic,*,default,mcmc,0p05|0p25,*,*,dynamic_exdqlm_lowmid_repair,FALSE,FALSE,repair calibration and q_rmse in low/mid tau dynamic MCMC,these are the weak dynamic MCMC clusters
dynamic_lowmid_vb_repair,phase4_dynamic_repair,9,repair,dynamic,*,default,vb,0p05|0p25,*,*,dynamic_exdqlm_lowmid_repair_vb,FALSE,FALSE,repair calibration in low/mid tau dynamic VB,pplc wins alone are not enough when calibration collapses
